review_id,review,rating,time,aspect_index,topic,problem,sentiment,aspect,modified_flag,company,data_source
a1dc8fbf-6eaa-4da9-884a-117dfc4b2e00,youtube music does not play music downloaded on my phone says its unavailable bring back play music bad app very bad im going to itunes,1,2/26/2025 5:53,a1dc8fbf-6eaa-4da9-884a-117dfc4b2e00_1_e1ce78ad,functionality,does not play music downloaded on my phone,negative,music playback issues,False,YouTube Music,Android
fb0526c3-1276-4a8f-b618-182578bb492c,i cant even sign up i was getting tired of spotifys constant doubling down on terrible ux decisions  so i thought id give apple music a try surely the ux from one of the biggest tech companies in the world will be frictionfree  right turns out i may never know i have tried to set up a trial account in this app  but for some reason  every time i try  it immediately cancels my subscription so after nearly a decade of music streaming services  the bar for a quality ux is shockingly low,1,8/21/2024 20:20,fb0526c3-1276-4a8f-b618-182578bb492c_1_5e675182,other,Unable to sign up for a trial account.,negative,user experience issues with sign-up process,False,Apple Music,Android
ea3144bb-ea90-42a3-9d70-1502e68e54c6,i cant say enough about calm  in fact everyone who knows me knows that i swear by calm more than once daily to enable me to focus  control emotions  and have also seen my personal relationships and career develop beyond what i thought was possible tamara is my favorite next to cillian murphy  but i have to say there isnt any session i havent fully enjoyed if there was a lifetime membership i would do it this journey has changed the way i view everything in my life especially during the pandemic and political and social issues this year has brought im so much more grounded thank you calm and everyone who invests in this,5,10/30/2020 9:25,ea3144bb-ea90-42a3-9d70-1502e68e54c6_1_04462769,other,N/A,Positive,N/A,False,Amazon Music,IOS
f254e427-5b4b-4a64-a271-a3fd0214f166,starting out  they give you the premium version for 2 weeks  so you can enjoy listening to music while using other apps and also when your phone screen goes to sleep once that trial period ends and you are using the free version of the app  you get 15minute long advertisements and the music stops every 3 songs to ask if you are still listening and forces you to hit the yes button the premium version of this app is great  but making the free version so terrible that it is unusable is a marketing game that im just not going to play this app is worthless to me if i have to constantly interact with it to keep the music playing for more than 10 minutes at a time and the fact is  that its all just a thinly veiled attempt to get you addicted to the convenience of the premium version,1,11/7/2019 19:20,f254e427-5b4b-4a64-a271-a3fd0214f166_1_9eae3338,functionality,making the free version so terrible that it is unusable,negative,free version usability issue,False,YouTube Music,IOS
f59a3cc8-30f2-4131-aecf-e78d3e312099,terrible experience when purchasing and downloading music corrupted downloads and paid songs disappearing,2,2/17/2025 16:17,f59a3cc8-30f2-4131-aecf-e78d3e312099_1_6fac96f1,functionality,corrupted downloads,negative,purchasing experience,False,Amazon Music,Android
47a4ef8b-9265-4897-a319-8d59a1e14c5e,i want to know how you fix the bugs because my music will not play it cuts out im doing good if i can listen to one song without it cutting out you figure out how to fix that and you might have a radio station otherwise it sucks,2,2/15/2025 12:23,47a4ef8b-9265-4897-a319-8d59a1e14c5e_1_901b63f7,performance,my music will not play it cuts out,negative,music playback issues,False,Amazon Music,Android
7ced2091-39d6-4a0d-a9d4-77f3c3116463,sometimes it refuses to play any thing,1,1/12/2025 19:34,7ced2091-39d6-4a0d-a9d4-77f3c3116463_1_99ebad54,functionality,it refuses to play anything,negative,playback functionality,False,Apple Music,Android
71504a6d-8fa9-472e-a6af-ae3a073aab6c,it will not load up since my subscription expired it wont allow me to renew,1,2/14/2025 23:49,71504a6d-8fa9-472e-a6af-ae3a073aab6c_1_988a0d2e,customer_service,it will not load up since my subscription expired,negative,subscription renewal issue,False,Amazon Music,Android
9419b9d4-cc1e-4ee5-9655-c864e6a23c93,wow  thanks apple  so okay   its bad enough you didnt put same brain to use on third gen airpods so they actually stay in your ear forcing some of us an hour after we purchased them to lose one having to go back and buy another pair now as opposed to earlier models we also lose them when trying to press them to get to next song or pause also  where is volume control on these im tapping and tapping and tapping nothing  only to read today i cant be up anywhere where im not buttplugged into you or not connected to net wherebi must ask siri  permission to increase or decrease volume  sorry all you thousands of wifi only users or you guys who live in mountains also  cant seem to connect more than one ear at a time great plug n play using two apple products jobs would be proud  so where do i go backwards and order your less expensive but better airpod 2s again,1,12/7/2021 22:53,9419b9d4-cc1e-4ee5-9655-c864e6a23c93_1_9df538ef,functionality,losing one airpod after purchase,negative,design and fit of airpods,False,Apple Music,IOS
9419b9d4-cc1e-4ee5-9655-c864e6a23c93,wow  thanks apple  so okay   its bad enough you didnt put same brain to use on third gen airpods so they actually stay in your ear forcing some of us an hour after we purchased them to lose one having to go back and buy another pair now as opposed to earlier models we also lose them when trying to press them to get to next song or pause also  where is volume control on these im tapping and tapping and tapping nothing  only to read today i cant be up anywhere where im not buttplugged into you or not connected to net wherebi must ask siri  permission to increase or decrease volume  sorry all you thousands of wifi only users or you guys who live in mountains also  cant seem to connect more than one ear at a time great plug n play using two apple products jobs would be proud  so where do i go backwards and order your less expensive but better airpod 2s again,1,12/7/2021 22:53,9419b9d4-cc1e-4ee5-9655-c864e6a23c93_2_727a7ff1,other,cannot control volume without Siri,negative,volume control issues,False,Apple Music,IOS
e4efcc86-2bfe-4787-a61b-904b35d4522a,since i updated to android 12  the app crashes multiple times every day,5,2/25/2025 6:17,e4efcc86-2bfe-4787-a61b-904b35d4522a_1_d9110380,performance,the app crashes multiple times every day,negative,app stability issues,False,YouTube Music,Android
6ba1e47d-5088-4ae1-a4a4-ee2012b3cbd4,calm is my favorite app at the moment my sister and i listen to the sleep stories every night  and we love it i am asleep in minutes  i dont even know what happens at the end of half the stories i listen to my father came in my room one night and thought the music i was listening to was very relaxing  and i agreed the music is also great i bought premium and it is so worth it you get access to everything i do the breathing exercises every day before school it definitely calms your mind most of the narrators voices are very calming another thing is that every time you open the app it greets you with take a deep breath you can also change the backround which comes with calming music overall great app,5,4/22/2020 22:35,6ba1e47d-5088-4ae1-a4a4-ee2012b3cbd4_1_0e79ef7c,other,N/A,Positive,N/A,False,Amazon Music,IOS
4fa1f9e4-4a33-42e1-828c-a18ecaa1b1e1,app is fine for the most part  except i have to keep uninstalling and reinstalling everydayor the music keeps glitching and skipping please fix update cant even listen to music without it skipping on my bluetooth have tried other apps and bluetooth connection is fine it seems that it is only youtube music is anyone else experiencing this,1,2/10/2025 20:30,4fa1f9e4-4a33-42e1-828c-a18ecaa1b1e1_1_07806e4e,performance,music keeps glitching and skipping,negative,music playback issues,False,YouTube Music,Android
6564ff93-5e93-4b11-9893-2e490ced2b76,i love calm all and of it stories also the fact that calm is the only thing that helps me sleep i had a sleeping problem and i  hated going to sleep and id just stay up to a very late time where id only get a small amount of sleep but then i found calm where i can just relax and listen to calming stories that i never finish because id already be asleep when i rely on it  it never fails me it works every time i also like how every morning calm asks you how you slept and that every time i get to put great as my answer i would never delete this app it is a miracle worker and helps me sleep like nothing else does that is all i have to say for nowive encountered no bugs or anything needing to be fixed thank for the app that has helped me so much ,5,4/12/2020 14:31,6564ff93-5e93-4b11-9893-2e490ced2b76_1_186b993c,other,N/A,Positive,N/A,False,Amazon Music,IOS
e69e2267-152e-4b9c-9ff6-fde998e1b918,i got this last christmas eve used it for a while i decided to try it again before canceling my subscription reminded me how great the daily calm is i love tamaras voice and its a wonderful way to start your day and then i discovered the master classes dont know if i overlooked these when i first got the app or if its been added listened to elizabeth gilberts and was blown away just fantastic honestly either one of these is worth the price of admission and to have both plus other features i havent explored yet honestly im glad there is a subscription fee because it made me revisit this amazing tool i am using it every day again and it really is making a positive impact on my mood and overall feeling of happiness worth every penny if you are ready to be good to yourself give it a try thanks so much to everyone who created this app and is participating you have my sincere gratitude and love,5,12/20/2019 3:16,e69e2267-152e-4b9c-9ff6-fde998e1b918_1_b64b379f,other,N/A,Positive,N/A,False,Amazon Music,IOS
935754af-fb40-4bd6-b888-ad7eb29eb3a8,meditation is so not natural to me tried in the past  never worked saw an ad for calm somewhere that struck a note w me and decided to give it a try for a week whatever it is about the calm app actually works for me my mind and body soak up those lovely ten minute sessions like a sponge after a week i paid for the extended version and its probably the only app i dont regret paying for the short exercise sessions are great too so happy i gave calm a try after so many failed meditation attempts in the past i just did a session  went into it heart literally racingevery time i think its not going to work  but it has try it ive stuck with it for months now and i really love it,5,6/27/2019 21:28,935754af-fb40-4bd6-b888-ad7eb29eb3a8_1_5c4ff39e,other,N/A,Positive,N/A,False,Amazon Music,IOS
d34bbb39-0610-4235-b6be-70559a0e0734,i take breaks from this subscription and let it expire or cancel after it ends my purchased music become basically unplayable or theres serious malfunction in this app this problem has been going on for years and many ios versions its still a problem i just deleted app reinstalled and still my music doesnt work right needs work to resolve this issue also i make sure that i download my purchased music while not in a subscription,3,1/5/2025 0:27,d34bbb39-0610-4235-b6be-70559a0e0734_1_bbd53370,functionality,purchased music becomes unplayable after subscription expires,negative,music accessibility issues,False,Apple Music,IOS
d34bbb39-0610-4235-b6be-70559a0e0734,i take breaks from this subscription and let it expire or cancel after it ends my purchased music become basically unplayable or theres serious malfunction in this app this problem has been going on for years and many ios versions its still a problem i just deleted app reinstalled and still my music doesnt work right needs work to resolve this issue also i make sure that i download my purchased music while not in a subscription,3,1/5/2025 0:27,d34bbb39-0610-4235-b6be-70559a0e0734_2_f26f2956,other,serious malfunction in the app,negative,app functionality problems,False,Apple Music,IOS
ab2ec5f7-1465-43b7-9834-476b896238a8,my toddler likes the thomas the tank meditations i got the premium subscription for 70 a year out of desperation to get my kiddo to sleep apparently i was pretty sleep deprived myself because i bought it twice  as explained by the company representative one under the app store and one online with an email when i asked if she could stop one of them  she ghosted me i still cant seem to cancel one of them  and the other had been paid for the year anyway it was one day until the free trial ended  and the rep refused to help me regardless of the content  which i dont personally find helpful  i think ethically the company should not take advantage of people like that ive led groups on mindfulness meditation for years as a therapist  and i think this content is just okay search for mindfulness meditations and lots of free videos will pop up or try reading or listening to real mindfulness like jon kabatzin glad some people find this app useful  but i wish id never signed up paying for two premium subscriptions i barely use and the one i cant find auto renews  feeling duped,2,1/25/2021 5:22,ab2ec5f7-1465-43b7-9834-476b896238a8_1_5b9683fe,customer_service,I can't seem to cancel one of the premium subscriptions.,negative,customer service response,False,Amazon Music,IOS
caf55418-1ead-4547-859c-8fab34362c17,perfect i do have the paidfor version because it has everything i want in a music app and i love it podcasts are great  audio books  really useful search function that actually works it has everything the amount of different music ive found just from recommendations is amazing ive never had any problems using spotify so ill just keep on with my subscription and enjoy my listening it makes me happy,5,2/18/2025 19:24,caf55418-1ead-4547-859c-8fab34362c17_1_8395a66a,other,N/A,Positive,N/A,False,Spotify,Android
cd8e0b9d-0698-450f-9626-6faba27db4a2,update i do npt appreciate the splashing ads its way too hard to downvoteremoveignore songs the claim is that if you listen more  the recommendations will get better  but because i end up listening to songs i dont like  the algorithm just delivers more of the same the i dont like this song icon not sure what its called should get equal weight and be on all the same screens as the heart,3,2/9/2025 16:42,cd8e0b9d-0698-450f-9626-6faba27db4a2_1_abfba92d,ads,splashing ads are disruptive,negative,ad display issues,False,Spotify,Android
44ee9b94-ad35-4fb1-8710-70ea7c292d4b,the music selections are excellent and the quality is as good or better than my cds of the same albums that i possess,5,2/24/2025 16:16,44ee9b94-ad35-4fb1-8710-70ea7c292d4b_1_3742d42a,other,N/A,Positive,N/A,False,Amazon Music,Android
8cbecf09-ae0f-4d46-8b31-9ec9695cc3ca,i used to love this app until i found it playing the same tired songs over and over apparently there is no true shuffle for your playlists this app uses a smart shuffle feature which is based on trending music and songs youve played most so if you dont mind listening to the same music over and over than use spotify if not  use apple music severely disappointed,2,2/17/2025 21:31,8cbecf09-ae0f-4d46-8b31-9ec9695cc3ca_1_5659c10b,functionality,playing the same tired songs over and over,negative,playlist shuffle feature,False,Spotify,Android
fc91e3ca-6d75-4521-ba8c-09a4712b7bc0,downloads a playlist  set library to only show downloaded playlist  opens playlist and buffers on a downloaded playlist why bother giving an option to download in the first place it seems that youre offline  see downloaded songs click yes and it buffers why bother asking then its like whoever made the app was trying to copy spotify features but doesnt know why the features were there in the first place,1,2/16/2025 8:56,fc91e3ca-6d75-4521-ba8c-09a4712b7bc0_1_df55a290,functionality,opens playlist and buffers on a downloaded playlist,negative,playback issues with downloaded playlists,False,YouTube Music,Android
faf97922-45a7-47cb-bc35-0385b5aabd93,does the bare minimum  which is play music the ui is  has been terrible offline mode is a mess  if i try searching for anything offline the app will freeze the shuffle algo is not very good either ill probably stick around for the rest of the year but if nothing changes  i wont have a reason to continue my subscription,2,2/22/2025 10:11,faf97922-45a7-47cb-bc35-0385b5aabd93_1_b6b57d63,other,the user interface is terrible,negative,user interface issues,False,YouTube Music,Android
c83e0e53-fc12-4dc9-ba07-218080fcb444,this app prides itself on making it more and more hostile to casual users if youre looking for a spotify alternative and pay the subscription youre probably fine but if you just want to buy your songs and listen to what you bought youre shoveled ads for the subscription out the wazoo and after you select one of your purchased songs itll divert you to the streaming,1,12/31/2024 2:52,c83e0e53-fc12-4dc9-ba07-218080fcb444_1_a56d86cc,other,hostile to casual users,negative,user experience issues,False,Amazon Music,Android
79f26e04-131c-4ccc-844a-b0167f9eea33,its a wonderful app and ive been using it for as long as i can remember  and its the most convenient way for me to listen to my music while i do homework  clean  cook  whatever as of lately however  i cant play my music and its more inconvenient than it is helpful the issue is i will try to play a song  and it will either freeze and wont play  or it will play the first 912 seconds then stop im mostly upset because i have all of my music downloaded  but ive found the only way to fix this is to exit the app and it will autopause  then it will work but its tedious doing this for every single song  some of which wont even play i dont know what happened but since about a week and a half ago its been a hassle to listen to music ,5,2/26/2022 5:52,79f26e04-131c-4ccc-844a-b0167f9eea33_1_9adfca64,performance,the app freezes and won't play music or plays only a few seconds then stops,negative,music playback issues,False,Spotify,IOS
871a398e-f579-4d24-afbb-51059faf9ce2,this app is great and has a great selection of music  podcasts  audiobooks  and other audio  but it cant shuffle to save its life if they got the shuffling fixed it would be a 5 star app so close dropped another star because the family plan only allows audio book access to the account holdermanager  thats just greedy,3,2/25/2025 5:13,871a398e-f579-4d24-afbb-51059faf9ce2_1_f3894549,functionality,it cant shuffle to save its life,negative,shuffling functionality,False,Spotify,Android
42372b6f-171c-4f61-828d-c94b4a7eac78,ok  let me make myself clear this app has the potential to be amazing the problem ive been having is that ill make a new playlist  go to listen to it  and instead of playing the songs i selected  it will play random songs this on its own would be annoying  but theres more it wont let you skip unless you pay for premium  and im broke and cant waste money on that when i dont care about ads or playing a specific song first this will also randomly happen while playing any playlist  but after the song finishes a song i picked will play if you made it this far  thank you for reading  and please fix this  i just want to listen to the music i picked  not the stuff your algorithm thinks ill like,5,8/18/2019 18:41,42372b6f-171c-4f61-828d-c94b4a7eac78_1_eab1974d,functionality,The app plays random songs instead of selected songs.,negative,playlist functionality,False,Spotify,IOS
1a7b76be-03e7-4c46-9ece-1d7a8288e329,google nuked their podcast app that worked fine and forced it onto yt music hardly ever plays correctly  if you skip ahead or back in an episode it just freezes and wont do anything at all regardless of hard refreshing the app its been a persistent problem for months now its literally just gotten worse,1,2/13/2025 21:43,1a7b76be-03e7-4c46-9ece-1d7a8288e329_1_24204b2a,performance,the app freezes when skipping ahead or back in an episode,negative,app performance issues,False,YouTube Music,Android
a9eee38c-6f82-4c88-95d2-22f892b1b6f2,who thought it was a good idea to require the screen to be on  and that this app needs to be open to listen to music on the free version on the free trial i was thinking about switching from spotify but im starting tothink this sealed the deal to keep me using spotify,3,2/21/2025 22:22,a9eee38c-6f82-4c88-95d2-22f892b1b6f2_1_7091ef47,functionality,app needs to be open to listen to music on the free version,negative,free version limitations,False,YouTube Music,Android
a174927b-155e-4858-a7b6-8438ff3712aa,cannot organize music various albums of music stored under the wrong artist songs are constantly being removed  so you have to redownload them if you delete the app due to a bug  it removes all your music from the device  but it shows the songs are still in the library the only reason i use this app is because of amazon prime  some music that isnt available anywhere else i wouldnt recommend it otherwise,1,1/24/2025 3:13,a174927b-155e-4858-a7b6-8438ff3712aa_1_4e59e965,functionality,cannot organize music under the wrong artist,negative,music organization issues,False,Amazon Music,Android
a174927b-155e-4858-a7b6-8438ff3712aa,cannot organize music various albums of music stored under the wrong artist songs are constantly being removed  so you have to redownload them if you delete the app due to a bug  it removes all your music from the device  but it shows the songs are still in the library the only reason i use this app is because of amazon prime  some music that isnt available anywhere else i wouldnt recommend it otherwise,1,1/24/2025 3:13,a174927b-155e-4858-a7b6-8438ff3712aa_2_8e90410f,other,songs are constantly being removed,negative,song availability problems,False,Amazon Music,Android
95f6a7a4-1a4a-45ef-a1ca-de396cce8379,ive used the unlimited music for close to ten years without issue until the last few months the app continuously gives me errors during listening and when attempting to switch songs it also will shut down randomly ive uninstalled and reinstalled and followed all of the options provided by customer support the issue remains i opened an account with another provider and their app works seamlessly alot like amazon used to i cannot continue to pay for a service that doesnt work,1,2/24/2025 18:13,95f6a7a4-1a4a-45ef-a1ca-de396cce8379_1_0c0646cb,performance,the app continuously gives errors during listening,negative,app performance issues,False,Amazon Music,Android
95f6a7a4-1a4a-45ef-a1ca-de396cce8379,ive used the unlimited music for close to ten years without issue until the last few months the app continuously gives me errors during listening and when attempting to switch songs it also will shut down randomly ive uninstalled and reinstalled and followed all of the options provided by customer support the issue remains i opened an account with another provider and their app works seamlessly alot like amazon used to i cannot continue to pay for a service that doesnt work,1,2/24/2025 18:13,95f6a7a4-1a4a-45ef-a1ca-de396cce8379_2_d6d25870,customer_service,shuts down randomly,negative,customer support effectiveness,False,Amazon Music,Android
4e7a36ef-0072-4450-856f-44dd45fa6d65,i have a lot of downloaded music that i paid for and i cannot play offline this is unacceptable what sort of garbage music app does not let you download and play music offline have the developers never been on an airplane  or out of cellwifi service i wish i could get all of my money back for all of the music i have purchased,1,2/21/2025 15:58,4e7a36ef-0072-4450-856f-44dd45fa6d65_1_5b1d53a0,functionality,cannot play downloaded music offline,negative,offline listening capability,False,Amazon Music,Android
2103f428-b0ea-47c1-9d93-ab7eab4ea545,not great on android auto tracks start to play then the sound cuts out around 510 seconds in to it  pausing and then playing the track brings the sound back artwork also regularly fails to load fix this apple and youll get the extra 2 i dropped,3,2/18/2025 22:34,2103f428-b0ea-47c1-9d93-ab7eab4ea545_1_58d284ce,functionality,sound cuts out during playback,negative,audio playback issues,False,Apple Music,Android
892a6ed9-fa49-4453-bbac-891668959c24,youtube premium music is the best app i have ever used and i have been with youtube premium for years and have never had a regret  thats right and this is my first app listend and never missed a small monthly bill for that small 12 mth it makes 99 of song clips and shows you what your playing ill be dead the day i dont have it you must have,5,2/21/2025 7:42,892a6ed9-fa49-4453-bbac-891668959c24_1_a737dc0b,other,N/A,Positive,N/A,False,YouTube Music,Android
2cc0aa5b-a858-4e7e-b70a-e16e3a150302,when i first downloaded the app i loved it because i could make my own playlists and it was always recommending me new music and artist and was always up to date when artist released new music  however ive had the app for a couple of years and i noticed that it started to say song unavailable and at first it was a couple of songs and i thought it got removed because some were songs i hadnt listened to in a while  however today i go on the app to listen to music and over half of my playlist with songs says song unavailable and when i tried to remove it and re add the song it wouldnt allow me to do so im sad because i love this app  but i heard it happened to people with a premium account as well  so unfortunately i have to find another app to listen to music on in the meantime please fix this,2,7/23/2020 14:21,2cc0aa5b-a858-4e7e-b70a-e16e3a150302_1_282c2efc,functionality,over half of my playlist with songs says song unavailable,negative,playlist availability issue,False,YouTube Music,IOS
