review_id,review,rating,time,aspect_index,topic,problem,sentiment,aspect,modified_flag,company,data_source
858972bb-39a4-4747-a204-a406fc600648,very useless and worst  you cant play any song more than one time and if you want to listen it again then you have to wait for 24 hours you cant skip songs more than 6 times in hour what a irritating feature you have to listen the song wheather you like it or not doesnt matter they irritate you upto the level where you are forced to buy their premium restrictions are all over please do not download this app total waste there are everything only for their premium members,1,2/24/2025 11:23,858972bb-39a4-4747-a204-a406fc600648_1_d470f6d3,functionality,you cant play any song more than one time,negative,playback restrictions,False,Spotify,Android
b24b22b7-0af5-4df9-b209-10f2a2a33193,this app is pretty good as of oct 2021 many of the old bugs that plagued the experience in the past are now resolved and generally the app is reliable it still has random bugs and strange ui controls that arent necessarily showstoppers which is why its not quite 5 stars  for example  it always displays the album art and track details in apple carplay from the first track of a playlist when you start playback with the shuffle all option even though some other track is playing this fixes itself once it advances to the next track  im also not a huge fan of swiping down to completely stop playback and find it not very intuitive it took a while to figure out how to dismiss the playback controls after the x icon was removed in a recent update,4,10/9/2021 14:33,b24b22b7-0af5-4df9-b209-10f2a2a33193_1_19d60bfc,functionality,still has random bugs and strange ui controls,neutral,user interface controls,False,YouTube Music,IOS
b24b22b7-0af5-4df9-b209-10f2a2a33193,this app is pretty good as of oct 2021 many of the old bugs that plagued the experience in the past are now resolved and generally the app is reliable it still has random bugs and strange ui controls that arent necessarily showstoppers which is why its not quite 5 stars  for example  it always displays the album art and track details in apple carplay from the first track of a playlist when you start playback with the shuffle all option even though some other track is playing this fixes itself once it advances to the next track  im also not a huge fan of swiping down to completely stop playback and find it not very intuitive it took a while to figure out how to dismiss the playback controls after the x icon was removed in a recent update,4,10/9/2021 14:33,b24b22b7-0af5-4df9-b209-10f2a2a33193_2_f087fe9e,other,not very intuitive to stop playback,neutral,playback functionality,False,YouTube Music,IOS
71c612ef-cca2-4bfc-b22a-312f8afe363d,audio quality is excellent and price is reasonable too,4,2/14/2025 6:00,71c612ef-cca2-4bfc-b22a-312f8afe363d_1_fc36b902,other,N/A,Positive,N/A,False,Apple Music,Android
6cf3c097-6cd9-4b83-9402-0f870adef849,app has stopped me downloading songs ive checked my account and all payments are up to date been trying for two days now reinstalled app switch phone off cleared cache think i will close account,1,2/25/2025 8:12,6cf3c097-6cd9-4b83-9402-0f870adef849_1_d985d695,functionality,app has stopped me downloading songs,negative,downloading songs issue,False,Spotify,Android
56209a3b-fe49-433b-a5c6-b02d7209395a,youtube music offers a great library of songs that are adfree on premium and easy to access even when offline it also recommends songs and albums based on your search activity from the app and youtube i would say it is worth it especially when on a premium subscription however  without a premium package  its services are stripped down to the basics which dont stand out to any user,4,12/25/2024 8:52,56209a3b-fe49-433b-a5c6-b02d7209395a_1_166b434a,functionality,without a premium package its services are stripped down to the basics,neutral,service limitations without premium package,False,YouTube Music,Android
e7105e40-bc84-42e3-844b-b561def307eb,apple music is fine if youre just listening with earbuds or in the car  but it does not play nice with google devices it was so frustrating to pay for a service that didnt meet my needs because it would not consistently cast to my google home devices from my phone  and casting to google isnt even an option on my ipad ultimately  im canceling and going back to spotify  which consistently works without headaches,2,1/5/2024 16:41,e7105e40-bc84-42e3-844b-b561def307eb_1_3bf5bf24,functionality,does not play nice with google devices,negative,compatibility with google devices,False,Apple Music,Android
91ed23a4-82e7-47e1-9b26-41fbf4af728c,googles al gore rhythm thinks i want to hear exactly the same type of music biased on the last song played with a different artist sometimes  thats ok not all the time tho apple music figured out i was listening to foreign artists and it crossed over from heavy metal  to german opera awesome btw  to a spanish ballad  to cur de pirate so many more i was able to hear for the first time thanks to this app guuzle wont let me spend credit or use gift cards so i hope 2 use this after trial,5,10/30/2024 5:44,91ed23a4-82e7-47e1-9b26-41fbf4af728c_1_ed19c6f2,recommendation_system,googles al gore rhythm thinks i want to hear exactly the same type of music biased on the last song played,neutral,music recommendation system,False,Apple Music,Android
6339936b-1953-49c1-9d9e-bd1adab89270,well i guess the app wont work correctly on my device again  blank screen when playing music   only thing i can do is skip songs as the like button doesnt even work now if it doesnt get better ill be switching back to dizzer,2,1/18/2025 16:19,6339936b-1953-49c1-9d9e-bd1adab89270_1_e893a78e,functionality,blank screen when playing music,negative,app functionality issues,False,Amazon Music,Android
ea4505e8-6e58-467e-85d7-896a2c6c3488,please  i should be able to search my downloaded songs whenever im offline please,4,2/25/2025 14:39,ea4505e8-6e58-467e-85d7-896a2c6c3488_1_9efd4374,offline_listening,unable to search downloaded songs offline,negative,search functionality for downloaded songs,False,YouTube Music,Android
48fb2eba-fb04-4eb7-a671-438d6db39d6f,i often cast music from the app on my sony tv whenever it is connected to the tv  overall app behavior becomes different  here are few examples  1 when i play from my downloaded list  it does not follow the list itself depending on what song i select to play from the downloaded list  the queue becomes random with songs which is not in sync  order with my list  2 moving a song up  down in the list also doesnt work well  if i try to drag a song from one position to another  and i hold down for longer than 23 seconds  the drag auto releases  and scrolls back to where i originally started the drag from  3 switching between song  video on the top bar is very slow  and sometimes reverses my choice  i have also seen a song being paused when attempting to switch tofrom song  video  besides this or when just using the app without being connected to the tv  it works great  just wish the integration was smoother for my particular scenario  using iphone 11 pro and have autoupdate on for apps  and the tv is brand new sony  so everything is relatively up to date on my side,4,6/27/2020 18:32,48fb2eba-fb04-4eb7-a671-438d6db39d6f_1_94207bdb,functionality,App behavior becomes different when casting to TV.,negative,casting experience with tv,False,YouTube Music,IOS
48fb2eba-fb04-4eb7-a671-438d6db39d6f,i often cast music from the app on my sony tv whenever it is connected to the tv  overall app behavior becomes different  here are few examples  1 when i play from my downloaded list  it does not follow the list itself depending on what song i select to play from the downloaded list  the queue becomes random with songs which is not in sync  order with my list  2 moving a song up  down in the list also doesnt work well  if i try to drag a song from one position to another  and i hold down for longer than 23 seconds  the drag auto releases  and scrolls back to where i originally started the drag from  3 switching between song  video on the top bar is very slow  and sometimes reverses my choice  i have also seen a song being paused when attempting to switch tofrom song  video  besides this or when just using the app without being connected to the tv  it works great  just wish the integration was smoother for my particular scenario  using iphone 11 pro and have autoupdate on for apps  and the tv is brand new sony  so everything is relatively up to date on my side,4,6/27/2020 18:32,48fb2eba-fb04-4eb7-a671-438d6db39d6f_2_8f36733c,performance,Queue becomes random when playing from downloaded list.,negative,playlist management issues,False,YouTube Music,IOS
48fb2eba-fb04-4eb7-a671-438d6db39d6f,i often cast music from the app on my sony tv whenever it is connected to the tv  overall app behavior becomes different  here are few examples  1 when i play from my downloaded list  it does not follow the list itself depending on what song i select to play from the downloaded list  the queue becomes random with songs which is not in sync  order with my list  2 moving a song up  down in the list also doesnt work well  if i try to drag a song from one position to another  and i hold down for longer than 23 seconds  the drag auto releases  and scrolls back to where i originally started the drag from  3 switching between song  video on the top bar is very slow  and sometimes reverses my choice  i have also seen a song being paused when attempting to switch tofrom song  video  besides this or when just using the app without being connected to the tv  it works great  just wish the integration was smoother for my particular scenario  using iphone 11 pro and have autoupdate on for apps  and the tv is brand new sony  so everything is relatively up to date on my side,4,6/27/2020 18:32,48fb2eba-fb04-4eb7-a671-438d6db39d6f_3_21c2aaca,other,Dragging songs in the playlist does not work well.,negative,switching between song and video,False,YouTube Music,IOS
ef3ac60f-0a03-4445-94d9-1e43ed2abd3a,the local song section of the apps doesnt open again after this recent update i cant access my local songs except i use other apps and this started happening after this previous update please fix,1,2/25/2025 10:00,ef3ac60f-0a03-4445-94d9-1e43ed2abd3a_1_9f8c5c17,functionality,the local song section of the app doesn't open after the recent update,negative,access to local songs,False,Spotify,Android
b9abc775-ccf5-4de3-a159-a38f49d89b5a,i bought a lifetime subscription in 2019 one week ago  i updated my phone for the first time in those 5 years i was suddenly locked out of calm premium though my account history still showed all the thousands of hours of listening ive done  im stuck in an endless loop of generic  unrelated macros with their support team who seems unempowered to actually help its been 8 days  and based on the emails ive gotten  i dont think anyone has actually read my requests or looked at my account  i depend on calm for sleep their product is amazing  but this horrible  stressful experience with their support team will make me use a different service just as soon as i find one,2,4/20/2024 3:15,b9abc775-ccf5-4de3-a159-a38f49d89b5a_1_1367bd48,customer_service,Locked out of premium subscription and unresponsive support team.,negative,customer support experience,False,Amazon Music,IOS
386c6ad1-86ab-4a2a-88d0-6f51a1de8650,hey guys i suggest you this app for songs generally i use it for mind relaxing after my whole day tiredness yep no doubt there are few ads in between songs if not buy premium but a for a teen  its not bad as after schools or colleges we feel a little dizzy or frustratedthen it comes to help no app is perfect but everyone try to improve thats why its better neither good nor best enjoy with spotify,4,2/25/2025 12:46,386c6ad1-86ab-4a2a-88d0-6f51a1de8650_1_8e868798,ads,there are few ads in between songs if not buy premium,neutral,ad interruptions during playback,False,Spotify,Android
842eeb94-c4c0-491d-8eaa-aece79966adc,honestly  i dont know where to start  i just cant out it out  how bad this issue is  this review is for people who cant have premium  why must i have to listen to songs always in shuffle  it just screws up the music taste  if it were to be in order  they could section off the music in their playlist  speaking of playing music  why must i have to wait so long to play songs the most ads i have ever had was 7 seriously in my last review i talked over this  but its apparent you never read them  but in case you do  i will write this another thing bad about the ad problem  why must i wait 30 seconds to skip an ad  only to get a whole bunch more this is just picking on the people who wont give you money this is so wrong and there needs to be a change to this  you gave us the opposite of what we asked for  we asked for less ads and you gave us more to add on  why do you add on more songs we never knew of or never inew the genre of just let us listen to the songs we want to honestly  this is supposed to be a music app  total shame,1,2/24/2021 10:31,842eeb94-c4c0-491d-8eaa-aece79966adc_1_b53640dc,functionality,songs always in shuffle,negative,playlist order issues,False,Spotify,IOS
842eeb94-c4c0-491d-8eaa-aece79966adc,honestly  i dont know where to start  i just cant out it out  how bad this issue is  this review is for people who cant have premium  why must i have to listen to songs always in shuffle  it just screws up the music taste  if it were to be in order  they could section off the music in their playlist  speaking of playing music  why must i have to wait so long to play songs the most ads i have ever had was 7 seriously in my last review i talked over this  but its apparent you never read them  but in case you do  i will write this another thing bad about the ad problem  why must i wait 30 seconds to skip an ad  only to get a whole bunch more this is just picking on the people who wont give you money this is so wrong and there needs to be a change to this  you gave us the opposite of what we asked for  we asked for less ads and you gave us more to add on  why do you add on more songs we never knew of or never inew the genre of just let us listen to the songs we want to honestly  this is supposed to be a music app  total shame,1,2/24/2021 10:31,842eeb94-c4c0-491d-8eaa-aece79966adc_2_cd690e2d,performance,long wait to play songs,negative,song playback delay,False,Spotify,IOS
a4f0e121-1de9-4274-b51e-e79449da9cff,restricted mode wont turn off while on mobile data and i am forced to use my downloads  and sometimes that doesnt even work its been like this for years and only turns off while on wifi my family members do not have this problem and i seem to be the only one but it is very annoying be i cant listen to any hip hop or rap or literally anything with explicit content ive tried everything from reinstalling the app to trying multiple accounts nothing works very annoying,2,5/25/2023 23:22,a4f0e121-1de9-4274-b51e-e79449da9cff_1_926fbbbb,functionality,restricted mode won't turn off while on mobile data,negative,restricted mode functionality,False,YouTube Music,IOS
28cb94d4-2532-405a-a315-0ab7867764fd,service is a fraud you cant log in on computer and if you call customer service they and their supervisors hang up on you you have to buy an unlimited plan twice they dont let you login on multiple devices need separate unlimited subscription for each one customer service is useless service does not work on computer you buy a music package but cannot use it rude supervisors are corrupt and poorly trained employees and they dont care hang up on you too you need to buy it twice scam,1,10/4/2024 0:32,28cb94d4-2532-405a-a315-0ab7867764fd_1_9d874afa,customer_service,service is a fraud you can't log in on computer,negative,login issues on computer,False,Apple Music,Android
28cb94d4-2532-405a-a315-0ab7867764fd,service is a fraud you cant log in on computer and if you call customer service they and their supervisors hang up on you you have to buy an unlimited plan twice they dont let you login on multiple devices need separate unlimited subscription for each one customer service is useless service does not work on computer you buy a music package but cannot use it rude supervisors are corrupt and poorly trained employees and they dont care hang up on you too you need to buy it twice scam,1,10/4/2024 0:32,28cb94d4-2532-405a-a315-0ab7867764fd_2_052c9f51,functionality,customer service hangs up on you,negative,customer service quality,False,Apple Music,Android
b84e20b9-8be0-4b71-b960-91547a0a5629,yeah  it aint bad sure  you can download music but this is how google makes it up to the people who lost all of their purchased music when they sold out to youtube tired of all these damn subscriptions and limited access to something as simple as music but still  better than most other music streaming services,5,2/5/2025 16:43,b84e20b9-8be0-4b71-b960-91547a0a5629_1_e2715f41,other,limited access to music,neutral,access to music services,False,YouTube Music,Android
16c9e4e5-1aff-46f8-87cd-43ef5a7e94eb,i had been struggling with falling asleep and plenty of mental illnesses with anxiety  overcoming trauma  trying to heal myself  and depression the premium is 100 worth it i cant imagine my life without this app and even if im not finding time to use the meditations like i do want to still working on finding time for those and making time for my mental health the daily check ins and gratitudes i do each day take less than five minutes and help me see that even if i felt like it was a horrible day so many good things also happened the daily reflections are also amazing helping me realize thoughts and answers i didnt know i had if i didnt just sit back think and listen overall this app has been incredible and i wouldnt change a thing 1000 worth the money such a large variety of things and tools to listen and work with to the people who made this app thank you so much for helping the millions of people out there like me,5,2/3/2022 2:05,16c9e4e5-1aff-46f8-87cd-43ef5a7e94eb_1_f4b9072f,other,N/A,Positive,N/A,False,Amazon Music,IOS
179ea450-2397-4f3a-98f1-83378a01f629,cant sign in due to require a verification code but its didnt text to me its required code from trusted devices which is not nearby me,3,2/3/2025 14:54,179ea450-2397-4f3a-98f1-83378a01f629_1_3b124b0b,security,cant sign in due to require a verification code but its didnt text to me,negative,sign-in process issues,False,Apple Music,Android
f611c766-66bd-48f1-9633-b8f89400ab56,in my car  i need to run an older version as the latest version causes it to crash or not load a the queue now the older version prompts an update an refuses to run how can i run this app on my car head unit that needs support for android 6 and 32bit,1,2/19/2025 22:05,f611c766-66bd-48f1-9633-b8f89400ab56_1_ff43fb3c,functionality,latest version causes it to crash or not load the queue,negative,app compatibility with head unit,False,YouTube Music,Android
18ffd1e0-fdc4-481f-84d1-e6f3c314299b,this app is becoming worst day by day jab takk ad puri naa dekhlo toh song play takk nahi hota please fix this issue ,1,2/25/2025 4:35,18ffd1e0-fdc4-481f-84d1-e6f3c314299b_1_a5601988,ads,ads are too long before songs play,negative,advertisement duration,False,Spotify,Android
78f8b094-19a7-41ef-a244-5ba373d4d6f8,an unbelievably poor replacement for play music  come on google you can do much better than this,1,2/14/2025 9:58,78f8b094-19a7-41ef-a244-5ba373d4d6f8_1_b87bb13e,functionality,unbelievably poor replacement for play music,negative,replacement quality for play music,False,Amazon Music,Android
7cef4438-54ab-481f-a5c2-a97268f38ee4,there is only a few complaints i have  a lot of songs i have tried to search arent there even though the song is an official one i searched a song on this app and i found one that is copying the original word for word  so if you could get that fixed it would be better  but i understand if you are unable to do that  if you could get these problems fixes i would be very appreciative  thank you for taking the time out of your day to read this and i hope this helps,4,6/21/2023 7:59,7cef4438-54ab-481f-a5c2-a97268f38ee4_1_93afcbe4,other,a lot of songs I have tried to search aren't there,neutral,song availability issue,False,Apple Music,IOS
ddb9b7f2-07d2-43e5-8f94-e81a329d6820,dolby atmos settings are changing on their own again i set it to music and it keeps switching back to auto by itself please fix this bug  it is frustrating,3,2/11/2025 21:25,ddb9b7f2-07d2-43e5-8f94-e81a329d6820_1_a7f53509,functionality,dolby atmos settings are changing on their own,negative,settings malfunctioning,False,Apple Music,Android
2f5bde11-2635-4f5b-aeda-27e88df229f1,algoritm for shuffle play library should have more variety at some point kinda starts repeating same songs,4,2/26/2025 0:27,2f5bde11-2635-4f5b-aeda-27e88df229f1_1_3842b3a8,functionality,shuffle play library should have more variety,negative,shuffle play variety,False,YouTube Music,Android
c85480c5-11a9-4eb8-9738-25d8932908d0,the app stops playing after a few songs or halfway through a song you have to manually go to the app and press play again very frustrating especially when driving sometimes have to click on a playlist multiple times just to get it to load instead of adding new features every update focus on fixing the bugs in the current version,2,4/2/2019 5:51,c85480c5-11a9-4eb8-9738-25d8932908d0_1_d349dda4,functionality,the app stops playing after a few songs or halfway through a song,negative,app playback issues,False,Apple Music,Android
8f73bc1f-fa2d-4efc-9b12-43f88d2b9aa1,the spotify is the awful app i have ever seen,1,2/25/2025 15:26,8f73bc1f-fa2d-4efc-9b12-43f88d2b9aa1_1_0e426f04,performance,awful app,negative,overall app experience,False,Spotify,Android
5a81cd33-494e-49a4-af40-6ba0f1b1920a,this year has been a crazy one for everyone my anxiety and stress had been on an all time high  so when i got the notification from american express that we could try the app for free i thought  what do i have to lose   meditation has now become my go to  ive made it the central part of my morning routine with the 10 min daily calm meditation to begin my day throughout the day  if i feel myself beginning to get tense and stressed  i know its my queue to go ground myself again with the app the guidance is excellent for beginners  like myself  and really helps you zone in   this app has made me more mindful  it allows me to slow down and ground myself before i react overall i would recommend instilling a daily meditation practice to anyone you truly do feel the difference  just be patient and give yourself grace  but stick to it,5,10/12/2020 13:16,5a81cd33-494e-49a4-af40-6ba0f1b1920a_1_ae8caff9,other,N/A,Positive,N/A,False,Amazon Music,IOS
a330b80e-4082-4b5f-8325-d904b51855c7,this app used to be fantastic when tamara started by herself it was more focused on the nature of meditation  development and not about celebrities like now it feels like as if this was the goal for her to reach this status instead of true meditation monks and buddhists dont need all the fuzz around it and calm was in the beginning fantastic and not too overwhelming with too much fuzz around it i left calm for better alternatives true to the core and wish tamara good luck  it is sad this app turned into a hype for her celebrity status and perhaps the desire to become one herself  instead of the person she was  humble  motivated  just herself the way i liked her most thank you for the great time i had on this app but time to move on,3,9/1/2021 4:44,a330b80e-4082-4b5f-8325-d904b51855c7_1_ab8445b8,other,the app turned into a hype for celebrity status,negative,focus on meditation,False,Amazon Music,IOS
083536d5-8e1d-440c-becd-a5d18993aa2a,i had several playlists that completely disappeared after an ios 18 update  other playlists that were diminished from several dozen songs to one or two songs playlists that id had for years nothing could or had been done about it it was saddening   disheartening and heartbreaking as the majority of that music was from my youth other than that i dont get to use a lot of the features offered by apple music as im not sure what the functionality for them are i dont get to explore much however the automatic favorites playlist was the best idea ever being a musician percussionist and a dancer i love music  i just wish i could keep what i add to my playlists once and would not have to take time to curate another list,2,11/5/2024 13:50,083536d5-8e1d-440c-becd-a5d18993aa2a_1_b9823c48,functionality,playlists disappeared after update,negative,playlist management issues,False,Apple Music,IOS
083536d5-8e1d-440c-becd-a5d18993aa2a,i had several playlists that completely disappeared after an ios 18 update  other playlists that were diminished from several dozen songs to one or two songs playlists that id had for years nothing could or had been done about it it was saddening   disheartening and heartbreaking as the majority of that music was from my youth other than that i dont get to use a lot of the features offered by apple music as im not sure what the functionality for them are i dont get to explore much however the automatic favorites playlist was the best idea ever being a musician percussionist and a dancer i love music  i just wish i could keep what i add to my playlists once and would not have to take time to curate another list,2,11/5/2024 13:50,083536d5-8e1d-440c-becd-a5d18993aa2a_2_1c4484f6,other,playlists diminished from several dozen songs to one or two songs,negative,lack of feature clarity,False,Apple Music,IOS
