review_id,review,rating,time,aspect_index,topic,problem,sentiment,aspect,modified_flag,company,data_source
1c5eb057-64bd-4409-8679-497f3f17a143,so i suffer from severe anxiety and major depression  and i use this app almost every day and i got off the phone with customer service at well manager from customer service after speaking with just regular support since they could not resolve the issue at that level and i felt lied to because they offered apple one for so many months or a month to see if i wanted that which canceled my three month subscription with apple music i am beyond irritated because i did not see that anywhere in any fine print then i am told that i must have selected apple tv and apple news instead of selecting music when i canceled the program for one so i feel lied to because i dont recall that then i was told they cant change it which i think is complete and utter dishonesty youre 1 trillion company and you cant change out an app for another i think its completely bogus and im totally dissatisfied and this has disrupted my entire morning and i hope nobody else has to ever deal with this so it would be very careful with apple and their little bundles,1,2/20/2025 21:08,1c5eb057-64bd-4409-8679-497f3f17a143_2_0df82332,other,customer service could not resolve the issue,negative,subscription management,False,Apple Music,IOS
da127d1d-daf0-450d-8de1-e0e9a5be4d16,shame on google this is still a onestar app this is still a frustrating user experience i cant believe they havent fixed this yet but the reviews i know im not the only user frustrated by this when casting to google home speaker groups it plays 25 songs of a large playlist and then stops the up next list only has 25 songs in it and also  if they ever ditch access to my uploaded music i will stop paying,1,1/6/2025 19:48,da127d1d-daf0-450d-8de1-e0e9a5be4d16_1_4365404b,functionality,frustrating user experience,negative,user experience issues,False,YouTube Music,Android
560e0e83-f9f6-4a3d-bffb-4236658b293b,somethings been happening recently where even if i press repeat on a certain artists songs or a queue i make  it doesnt work it wont repeat the songs and instead continues shuffling and playing random songs its driving me crazy sometimes i just want to listen to hozier or a certain song and it keeps playing other things,2,2/22/2025 7:12,560e0e83-f9f6-4a3d-bffb-4236658b293b_1_ca8161a4,functionality,it doesn't repeat the songs and instead continues shuffling and playing random songs,negative,repeat functionality issue,False,Spotify,Android
c6b54a38-4441-4a52-a1ff-a29668fe93de,every single time i open the app it wants me to subscribe to amazon music unlimited even though im already subscribed or to enable bluetooth why or some other nonsense could you space these out to only pester me once a month sheesh and recommendations are bad for niche listeners im listening to all chiptune this morning  but its still recommending weeknd and listing it as recent,1,1/10/2025 17:23,c6b54a38-4441-4a52-a1ff-a29668fe93de_1_a078c2f6,customer_service,app constantly prompts for subscription even when already subscribed,negative,subscription prompts frequency,False,Amazon Music,Android
68294566-5fb5-40c6-afec-0b9071d9190a,still waiting on a response on why im not getting a code never gave me the option to get my verification code via text message but yes for sure i was able to login on the browser not the app i can now confirm that my change to anything other than ios have been the smarter move all along so much for practical and universal use its more like extremely complicated and available for highly educated computer experts users im just disappointed for all the time i gave in,1,2/23/2023 17:50,68294566-5fb5-40c6-afec-0b9071d9190a_1_7dcd9e3d,customer_service,not getting a verification code,negative,verification process issues,False,Apple Music,Android
68294566-5fb5-40c6-afec-0b9071d9190a,still waiting on a response on why im not getting a code never gave me the option to get my verification code via text message but yes for sure i was able to login on the browser not the app i can now confirm that my change to anything other than ios have been the smarter move all along so much for practical and universal use its more like extremely complicated and available for highly educated computer experts users im just disappointed for all the time i gave in,1,2/23/2023 17:50,68294566-5fb5-40c6-afec-0b9071d9190a_2_95028fe3,other,app is complicated to use,negative,usability challenges for general users,False,Apple Music,Android
daa2377c-78ea-4629-bbac-67dbc8e8151e,apple music has everything i love  tons possibly millions of songs that i want to listen to and add to my collection i love making playlists based on themes and favorites of mine  i can access any genre or song and share with family and friends i can also create listening stations and more with a low monthly price  great app to have if you are a music lover ,5,12/6/2024 17:37,daa2377c-78ea-4629-bbac-67dbc8e8151e_1_a2986242,other,N/A,Positive,N/A,False,Apple Music,IOS
17d4a86d-9326-4c24-ab63-2c42c3f47f08,why do i pay for premium when the app closes while in the background,1,2/25/2025 19:39,17d4a86d-9326-4c24-ab63-2c42c3f47f08_1_95702399,performance,the app closes while in the background,negative,app stability issue,False,YouTube Music,Android
33f1e904-5bfe-43d3-84f8-25f69fc08a5a,premium is worst like always recent updates are jst worst spotify stop going behind money and make it free,1,2/25/2025 5:59,33f1e904-5bfe-43d3-84f8-25f69fc08a5a_1_840c08c3,functionality,premium is worst,negative,premium service quality,False,Spotify,Android
698095ff-a93f-4285-9c29-6c71a92f2f35,had good features but too invasive abuses you privacy it abuses bluetooth tech to map everything and even tried to connect to unknown devices on by default now it no longer acts online even though everything else works still not happy with paying the ridiculous fee when theyre collecting all the information they get from us they should be paying us however the service has gotten better but theyre not very privacy concerned at all still unfortunately nonexistent,3,2/25/2025 0:20,698095ff-a93f-4285-9c29-6c71a92f2f35_1_801f90f5,other,invasive privacy issues,negative,privacy concerns,False,Spotify,Android
698095ff-a93f-4285-9c29-6c71a92f2f35,had good features but too invasive abuses you privacy it abuses bluetooth tech to map everything and even tried to connect to unknown devices on by default now it no longer acts online even though everything else works still not happy with paying the ridiculous fee when theyre collecting all the information they get from us they should be paying us however the service has gotten better but theyre not very privacy concerned at all still unfortunately nonexistent,3,2/25/2025 0:20,698095ff-a93f-4285-9c29-6c71a92f2f35_2_82b7f619,functionality,connects to unknown devices,negative,device connectivity issues,False,Spotify,Android
26613837-e179-4ce6-8cee-966fe34b4af7,this is best to song all song are available in the app and best sound quality,5,2/25/2025 17:30,26613837-e179-4ce6-8cee-966fe34b4af7_1_2c601bcc,other,N/A,Positive,N/A,False,Spotify,Android
a8e20aca-b1c2-4ef5-a2f5-22f5725113cb,i dont know why but sometimes out of nowhere the app will just refuse to play over half the songs in my playlist its like it would rapidly skip songs and then pause as if to let you press play and the does it all over again on the off chance that it does play a song  it wont play another one after that it will start skipping and refusing to play songs  even if they are bought andor downloaded its annoying and frustrating  to say the least  especially when im trying to listen to my music on a hour commute to work in traffic fix this ,3,4/6/2022 19:15,a8e20aca-b1c2-4ef5-a2f5-22f5725113cb_1_e56bdcef,functionality,the app will just refuse to play over half the songs in my playlist,negative,app functionality issues during playback,False,Apple Music,IOS
a8e20aca-b1c2-4ef5-a2f5-22f5725113cb,i dont know why but sometimes out of nowhere the app will just refuse to play over half the songs in my playlist its like it would rapidly skip songs and then pause as if to let you press play and the does it all over again on the off chance that it does play a song  it wont play another one after that it will start skipping and refusing to play songs  even if they are bought andor downloaded its annoying and frustrating  to say the least  especially when im trying to listen to my music on a hour commute to work in traffic fix this ,3,4/6/2022 19:15,a8e20aca-b1c2-4ef5-a2f5-22f5725113cb_2_e70e3505,performance,it will start skipping and refusing to play songs even if they are bought or downloaded,negative,skipping songs and refusing to play,False,Apple Music,IOS
37498d4e-fc56-412f-a1d2-d930df9d6d98,i miss when the app had minimized adds and didnt have like 15 adds that take forever to playslightly exaggerated after almost every song  its like music apps amazon spotify apple  etc worry a lot more about the money rather than the people  using their app with a free subscription having a good experience and then wanting to support the app with a subscription i miss the old app  and just want to listen to music without hearing the same exact adds for the 100th time and not get adds promoting playlists that are faaar from my music taste  at least if your gonna have as many adds as you do at least make them personalized to that specific person and their music taste if the app or any other app keeps going the money hungry route im not sure im going to use keep using any music app and just start purchasing my music so i at least own it after downloading,2,7/11/2023 20:04,37498d4e-fc56-412f-a1d2-d930df9d6d98_1_9de9ce01,ads,Too many ads that are not personalized.,negative,advertisement frequency and relevance,False,Spotify,IOS
6791c17a-9f9b-4cc2-a46a-30abe039d0b0,becoming worst and worst day by day only the one who buys their premium packages will get to hear music and people with no premium packages will not be able to skip song  not be able to forward the music  not be able to hear songs by order in album  and many more basic actions are restricted for nonpremium user i would say that it is the worst music app  do not install,1,2/6/2025 17:15,6791c17a-9f9b-4cc2-a46a-30abe039d0b0_1_e5361446,other,many basic actions are restricted for nonpremium users,negative,premium package limitations,False,Spotify,Android
eb7048c4-ffea-4ff4-af91-6107f991abf3,i refuse to listen to an ad after each song played  so i deleted the app  too many ads i mean  the radio will play 10 songs in a row then cut to a specific amount of time for ads yall will spend 5 minutes between songs trying to sell me drugs i will never take   of course i can hit the ad skip buttonbut not if i am working i set up the record player in the studio this app is no longer nonessential   yall like advertisements heres one i want to paint a screenshot from super mario bros 3 this will take 25 48 x 36 canvases and a team of five assistants i need 3 million dollars,1,6/30/2024 1:08,eb7048c4-ffea-4ff4-af91-6107f991abf3_1_4eee7c5d,ads,too many ads after each song,negative,advertisement frequency and interruption,False,YouTube Music,IOS
355e1413-e115-4ca8-9c1f-f390ea7655ad,best song quality u can get here im so amazed after this i cant go back to spotify,5,1/20/2025 11:50,355e1413-e115-4ca8-9c1f-f390ea7655ad_1_d60c8ac1,other,N/A,Positive,N/A,False,Apple Music,Android
503beef0-d50a-4426-997d-b01d763f4a4c,its mostly great  but its been getting more expensive the reason i bought a subscription was so i could listen chronologically to several broadway albums in one playlist  but recently my playlist no longer keeps the songs in chronological album order when ordered that way  thus effectively shuffling the songs anyways if this doesnt get sorted literally lol  im probably going to stop paying  as the chronology by song order per album was the only reason i went premium please fix this,2,2/3/2025 0:20,503beef0-d50a-4426-997d-b01d763f4a4c_1_9ca3c4a7,functionality,playlist no longer keeps songs in chronological order,negative,playlist functionality,False,Spotify,Android
07d02d21-2f31-493c-940f-8fcdee1a09d5,inability to keep songs that arent mainstream or just changing the file and removing it from your library functionality of the app is one of my favorite but as the years go by more artists leave because apple is just another corporate demon,2,12/5/2024 4:22,07d02d21-2f31-493c-940f-8fcdee1a09d5_1_6f2e2f43,other,inability to keep non-mainstream songs,negative,song availability issues,False,Apple Music,Android
805c8046-703c-41e9-83a1-4ed9e9ed3c09,every time i open the app it crashes whats the point of paying for a premium plan just to not be able to listen to anything,1,2/25/2025 12:06,805c8046-703c-41e9-83a1-4ed9e9ed3c09_1_90b12a3f,performance,app crashes when opened,negative,reliability of the app,False,Spotify,Android
eea44b5f-a8e3-4975-a86a-106c0fb7939e,i used to love this app but now it sucks i would 100 vote it 0 stars if i could this new update is horrible 1 u cant unshuffle the dang playlist without getting premium 2 u have a monthly limit to ur lyrics what help is that and lastly  the amount of ads is unnecessary u may give us an ad saying  enjoy these 30 minutes of uninterrupted music but no like 2 songs later we get an ad u also may say  were always making changes and improvements to spotify well this one made it worse,1,2/9/2025 22:57,eea44b5f-a8e3-4975-a86a-106c0fb7939e_1_34316640,functionality,new update is horrible,negative,playlist management issues,False,Spotify,Android
eea44b5f-a8e3-4975-a86a-106c0fb7939e,i used to love this app but now it sucks i would 100 vote it 0 stars if i could this new update is horrible 1 u cant unshuffle the dang playlist without getting premium 2 u have a monthly limit to ur lyrics what help is that and lastly  the amount of ads is unnecessary u may give us an ad saying  enjoy these 30 minutes of uninterrupted music but no like 2 songs later we get an ad u also may say  were always making changes and improvements to spotify well this one made it worse,1,2/9/2025 22:57,eea44b5f-a8e3-4975-a86a-106c0fb7939e_2_eb918d24,other,can't unshuffle the playlist without premium,negative,premium subscription limitations,False,Spotify,Android
fcaf4883-22d7-4290-b3c9-f7b0f716e580,spotify has gotten better over the years but there are still some major issues most of the problems i have seem to be related to the algorithm i have over 4k songs in my liked songs playlist yet the random setting plays some songs repeatedly every day or two while never playing other songs in this playlist and the most playedfavorite song list i get at the end of the year hasnt been a song i particularly like but rather a song the algorithm has decided to play repeatedly over the year,2,2/9/2025 17:40,fcaf4883-22d7-4290-b3c9-f7b0f716e580_1_80b97598,functionality,major issues related to the algorithm affecting song selection,negative,algorithm performance affecting song selection,False,Spotify,Android
66000f02-e503-4c50-976e-6c7f6ef79fbc,not that good  i have to pay just to listen to songs in order and to view lyrics  why does spotify have to monetize these features that can be free and they are supposed to launch a music pro tier for 6 extra usd beware when looking into this service,3,2/25/2025 23:46,66000f02-e503-4c50-976e-6c7f6ef79fbc_1_7fd3c98d,other,have to pay just to listen to songs in order and to view lyrics,negative,monetization of features,False,Spotify,Android
fa426696-551f-480c-8be0-b770bdfaae6e, pixelated notification album art not keeps last song and playing last session alive also you cannot search song in your playlist or by artist  ,1,2/21/2025 10:42,fa426696-551f-480c-8be0-b770bdfaae6e_1_9355f6b4,functionality,pixelated notification album art,negative,notification album art quality,False,Amazon Music,Android
47ed7120-159f-461f-be95-542eeef042a2,ok google is a huge company their experience that this specific service offers is so inadequate and even frustrating for a company this big do not sign up for the free month premium tryout they will charge you a month ahead within a couple of days youre basically stuck with it for 2 months  and if you like it  great  but if you dont  well here we are and if you do it through itunes  it is impossible  i mean impossible  to request a refund on googles platform  although of course google being mediocre and buggy as they are their stuff is just buggy all the time  they cant ever charge for it  they do not explain how to you have to go through itunes to request a refund just listen to their commercials keep clicking in still watching buttons which are so dumb  and go about your business without having to pay for google services with dollars instead keep paying for them with your privacy  and ad time as you always have done lol,1,11/17/2022 22:45,47ed7120-159f-461f-be95-542eeef042a2_1_e980ac19,customer_service,inadequate service and frustrating experience with billing issues,negative,service experience and billing process,False,YouTube Music,IOS
a3e5b103-f69d-4b62-9d02-451a01155e69,i am here because i really want to give this app a chance to remedy the problem ive been having that used to happen occasionally but now happens at least once every 3 songs  sometimes multiple times per song the issue is playback stopping for no reason at any given time  interrupting anything playing and youd think simply stopping what im doing to go back and hit play would fix it  right wrong i hit play  and it looks like its playing  but doesnt the only thing that works is closing out the app and restarting it for the amount of money i pay for these services  it should play flawlessly and yes  im connected to wi fi  plenty of storage available plus an unlimited data plan please fix this so im not forced to switch to a cheaper service that can actually play continuously thanks,3,2/25/2022 0:07,a3e5b103-f69d-4b62-9d02-451a01155e69_1_81976c33,performance,playback stopping for no reason,negative,playback issues,False,Apple Music,IOS
709196ec-396d-4d87-930c-c1bb05ef8f1d,i understand limiting skips but i dont get why when you shuffle a playlist of album on the phone app it constantly gives songs from random other artists doesnt make any sense to me honestly makes me want to not use the app this is honestly so simple to change  the old app used to be much better another issue is that sometimes you can add songs to playlists when you click on them  you have to click on them in a playlist instead of straight up clicking which just takes extra time spent to search for a playlist there are other small similar issues like this which just make the experience a bit worse which builds up to just be bad   the computer app is totally great  if the phone app could just have the same basic capabilities this would turn my rating to a 65 please change it im not even asking for more skips  i just want it to shuffle what i want it to shuffle  be able to click view more songs on an artist and actually view more songs  and actually be able to add the song to my playlists when i click it  also make the ability to add several songs to a playlist at one or one song to multiple playlists thank you,1,8/30/2020 8:24,709196ec-396d-4d87-930c-c1bb05ef8f1d_1_1c517213,functionality,Shuffle function includes songs from random other artists,negative,shuffle functionality issue,False,Spotify,IOS
709196ec-396d-4d87-930c-c1bb05ef8f1d,i understand limiting skips but i dont get why when you shuffle a playlist of album on the phone app it constantly gives songs from random other artists doesnt make any sense to me honestly makes me want to not use the app this is honestly so simple to change  the old app used to be much better another issue is that sometimes you can add songs to playlists when you click on them  you have to click on them in a playlist instead of straight up clicking which just takes extra time spent to search for a playlist there are other small similar issues like this which just make the experience a bit worse which builds up to just be bad   the computer app is totally great  if the phone app could just have the same basic capabilities this would turn my rating to a 65 please change it im not even asking for more skips  i just want it to shuffle what i want it to shuffle  be able to click view more songs on an artist and actually view more songs  and actually be able to add the song to my playlists when i click it  also make the ability to add several songs to a playlist at one or one song to multiple playlists thank you,1,8/30/2020 8:24,709196ec-396d-4d87-930c-c1bb05ef8f1d_2_b37e1aae,other,Unable to add songs directly to playlists,negative,playlist management inefficiency,False,Spotify,IOS
d5bcbb44-0c37-4f04-9261-b3d259cd0230,great for playing high quality music  no doubt i that qupdates required 1 the app needs podcasts within it 2 its search feels way older than competitors 3 it is way too heavy on device,3,2/6/2025 5:49,d5bcbb44-0c37-4f04-9261-b3d259cd0230_1_10f6069f,other,the app needs podcasts within it,neutral,podcast availability,False,Apple Music,Android
0f65a913-8602-4b45-8f4a-e623777709fe,this app is driving me bonkers now it wont let me download music ive purchased onto my phone it shows as in my library on the app but the option to download is greyed out dont know whats going on but it needs sorting fast,1,2/16/2025 16:06,0f65a913-8602-4b45-8f4a-e623777709fe_1_cb4493b0,functionality,wont let me download music ive purchased onto my phone,negative,downloading purchased music,False,Amazon Music,Android
ef348fce-2e30-4d83-895f-62955f0f668b,ill keep it simple the fact that the music app takes over every time in my car bluetooth after a phone call is nuisance enough for me to delete the app from my phone and the fact that it always starts at the beginning of the same song when it starts is even more frustrating combine that with the fact that random order is not random at all apple music changes the order of the songs in a playlist but plays the songs in that same order every time makes me less interested in enduring the frustration when i have other options,1,9/29/2023 16:21,ef348fce-2e30-4d83-895f-62955f0f668b_1_be1d049e,functionality,the music app takes over every time in my car bluetooth after a phone call,negative,bluetooth connectivity issues,False,Apple Music,IOS
8515a881-0df4-4439-a1b5-61f39b6b157a,after having calm for several months now  ive enjoyed exploring to the variety of content from masterclasses to music to meditation i also like the approach calm takes in encouraging you to develop your own daily practice of mindfulness however  the main reason why i purchased calm was for the large library of meditations however the bulk of new meditations come from the daily meditation which is always guided by the same person  tamara levitt she also guides many of the meditation series they have available unfortunately i dont enjoy how tamara does her meditations and i find them more distracting than helpful because of this i find myself avoiding her meditations and whenever there is a choice for another voice ill pick it  but there are only so many of these and  if youre not doing the daily meditations  it doesnt take too long before you feel like youre running out of content calm is great if you enjoy tamaras meditations  but your kind of out of a deal if you dont i just think its unfortunate that there isnt more variety in the voices available and authors coming out with new content my wish would be for calm to at least have a second choice for the voice of the daily calm,2,8/6/2020 16:00,8515a881-0df4-4439-a1b5-61f39b6b157a_1_7dc9b07e,other,not enough variety in meditation voices,neutral,variety of meditation content,False,Amazon Music,IOS
4869a18e-200f-4e9b-bb52-53d5b97a4543,this app keeps crashing ever since the last update i cant scroll through my library at all its getting frustrating been using this app for years  no problems till this last update,2,2/26/2025 4:04,4869a18e-200f-4e9b-bb52-53d5b97a4543_1_7a1847f2,performance,this app keeps crashing ever since the last update,negative,app stability issues due to updates,False,Spotify,Android
c2e89472-37c7-429d-9fb8-2dc07a328c5e,this app is a gamechanger for music lovers it seamlessly blends the best of youtube with a massive music library switching between audio and video is incredibly smooth  which is perfect for live concerts  dj sets  and more the aipowered playlist cover art generator is a cool touch  and the google assistant integration is super convenient highly recommend,5,12/20/2024 9:23,c2e89472-37c7-429d-9fb8-2dc07a328c5e_1_673c6789,other,N/A,Positive,N/A,False,YouTube Music,Android
3f5d8b7b-c300-4568-99a0-d69344dfe6fd,i have been enjoying this app for quite a long time until suddenly  if you click shuffle it will stay for about 2 mins before the music starts playing  its quite annoying and frustrating  please work on this asap  i thought my subscription is about to expire  but i renewed it few days ago and im still having the same issue  please resolve this thank you,1,1/20/2025 20:28,3f5d8b7b-c300-4568-99a0-d69344dfe6fd_1_8ffb22a8,functionality,shuffle feature delays music playback,negative,music playback delay issue,False,Apple Music,Android
6372e4a0-3b5a-47bb-ab09-78e09e9d65fc,i still dont like the interface at all its obnoxious  in that trying to play the music ive paid for is buried deeply past all manner of unwanted attempts to upsell me to things i know i dont want amazon isnt the company they were circa 2009 when they introduced autorip that was when they had an honest understanding of what a customer is thats long gone and the ui shows it just make it easy to use and access what ive paid for that isnt rocket science,1,1/24/2025 8:40,6372e4a0-3b5a-47bb-ab09-78e09e9d65fc_1_86c23152,other,the interface is obnoxious and difficult to use,negative,interface usability,False,Amazon Music,Android
