review_id,review,rating,time,aspect_index,topic,problem,sentiment,aspect,modified_flag,company,data_source
8b762204-f77c-43ba-822d-da39f031cc2c,this is like my favourite app ever it is super great i love music and i always use this app youtube music you nailed it there are just a few tiny mistakes for one i feel like you should be able to hum or whistle a song if you dont know the name so that you can search it and be able to listen to it more often than just on the radio or at the shops second of all is not actually a complaint the rest of the rest of the app is perfect i rate this app a 98 out of 10,5,2/14/2025 18:35,8b762204-f77c-43ba-822d-da39f031cc2c_1_efcf8194,other,N/A,Positive,N/A,False,YouTube Music,Android
d2b29283-6e56-4e56-8615-b8fb5d0d6039,i really enjoy it audio quality is really good and it was easy to figure out how to navigate around if youre coming from google play i wish it had an option where you could save your queue as playlist i cant make smart playlists on my android device but can on my macbook  i think thats not fair i dont use the exclusive stuff much  but it would be great of you add your podcasts for android phone users who cant access podcasts,4,6/11/2022 8:55,d2b29283-6e56-4e56-8615-b8fb5d0d6039_1_961e155d,functionality,I wish it had an option where you could save your queue as a playlist.,neutral,playlist saving option,False,Apple Music,Android
ddd0c4a9-2757-4e88-8dda-b877f566972f,worth it just for the ad free audioonly background playing otherwise impossible on iphone the offline playlist is a nice bonus  only frustration thus far has been when trying to resume listening after closing the app in the middle of a playlist there does not appear to be any smooth way to resume where you left off you gotta open the playlist and find the specific song  there it will have saved your spot if you open it in your history it doesnt play the playlist  just that song,5,2/8/2018 21:14,ddd0c4a9-2757-4e88-8dda-b877f566972f_1_a0638202,functionality,no smooth way to resume listening after closing the app,neutral,resuming playback experience,False,YouTube Music,IOS
0b795a45-2cdb-47b8-be9d-5a79307debfc,my main problem is  after picking the artistbands im interested in they really dont played you guys pretty much just revert everything back to what is popular now which is no near what i want to listen to also i started to put a playlist together and then tried to listen to it on shuffle instead of just playing the songs on my playlist it started playing random songs i had not put on there i do like being able to find pretty much anything i want to listen to,4,9/17/2019 18:22,0b795a45-2cdb-47b8-be9d-5a79307debfc_1_27807d4e,recommendation_system,the app plays popular songs instead of selected artist bands,neutral,artist selection and recommendation,False,YouTube Music,IOS
0b795a45-2cdb-47b8-be9d-5a79307debfc,my main problem is  after picking the artistbands im interested in they really dont played you guys pretty much just revert everything back to what is popular now which is no near what i want to listen to also i started to put a playlist together and then tried to listen to it on shuffle instead of just playing the songs on my playlist it started playing random songs i had not put on there i do like being able to find pretty much anything i want to listen to,4,9/17/2019 18:22,0b795a45-2cdb-47b8-be9d-5a79307debfc_2_766c14c2,functionality,the shuffle feature plays random songs not in the playlist,neutral,playlist management and shuffle feature,False,YouTube Music,IOS
2c52b4e6-3cf7-4356-9c66-4d7641e4ae8b,one of the most stupid and horrible players around especially playing podcasts never plays in a proper loop edit after 2 years app is more horrible deletes all downloaded songs for no reason when whole album is downloaded songs dont appear in the library songs searching songs is a nightmare,1,1/19/2025 10:51,2c52b4e6-3cf7-4356-9c66-4d7641e4ae8b_1_ebdeb7eb,functionality,app deletes all downloaded songs for no reason,negative,download management issues,False,Amazon Music,Android
1b3772eb-0f8c-40da-ae11-93e07c3b3a2e,paid for the app but still not allowed to download songs and its not available on rooted devices,4,2/22/2025 16:38,1b3772eb-0f8c-40da-ae11-93e07c3b3a2e_1_f0d576a6,functionality,not allowed to download songs,negative,downloading songs feature,False,Apple Music,Android
741655d1-de46-4b99-b1a8-160fb6749c69,you always make the app worse at every turn i dont want to follow an artist just because i have one song liked by them i want to be able to search the songs i like by artist or album i hate the artist pages they are useless this is such a garbage app now  i wish it would revert back to the way it was a few years ago  it was much more user friendly going to find a new music app now,1,1/7/2025 22:15,741655d1-de46-4b99-b1a8-160fb6749c69_1_ee82c3f0,other,artist pages are useless,negative,usability issues with artist pages,False,Amazon Music,Android
3d1df723-0db9-42a3-8006-cf607c2e8aab,ive had this since the last few months of 2019  and throughout my time owning it ive encountered many glitches and just genuinely annoying issues for instance downloaded music not playing unless i reset my phone  songs disappearing and then reappearing after i reopen the app  playlists randomly getting deleted  apple music categories metal  hard rock  alternative  etc disappearing  downloading glitch where it wont download the song until i delete it and redownload it  and many others please fix these issues or i may be forced to cancel my subscription and move to another music streaming service  which i dont want to do especially since i have 40gb of music downloaded but i will if i keep encountering these problems,3,4/29/2022 5:14,3d1df723-0db9-42a3-8006-cf607c2e8aab_1_ff9efe12,functionality,glitches and annoying issues,negative,music playback issues,False,Apple Music,IOS
fffb6ae6-309d-4ca5-b42b-fb7a1ffff132,best music app  imop the premium feature only elevates the listening experience whether its gym vibes  chill nights  or a mix of everything  stopify has what you need my favourite feature is the spotify dj it offers personalised music from the most recent favourites to the old drip you forgot about id give 10 stars  but 5 is the limit,5,9/5/2024 4:37,fffb6ae6-309d-4ca5-b42b-fb7a1ffff132_1_102d2e1b,other,N/A,Positive,N/A,False,Spotify,Android
12b1c9ac-e4ba-4767-a123-6b73f3de7110,the shuffle and smart shuffle are terrible it will shuffle the same 20 songs while playing a 200 song playlist if you then skip a song  it will come back on after a couple of songs  and when you skip it again  the same bs will happen they give some excuse that the system cant handle that many songs then maybe fix it many of my friends have switched to different services  and i myself will probably switch to tidal,1,2/2/2025 21:37,12b1c9ac-e4ba-4767-a123-6b73f3de7110_1_d2c164fc,functionality,the shuffle and smart shuffle are terrible,negative,shuffle functionality,False,Spotify,Android
dc4b6a59-151c-4d3b-8b6e-a5dadbd77cd2,this app is garbage it stops playing music at random times and then you have to restart your phone in order to get the music playing again the radio stations are basically play lists with maybe 15 songs on them when you advertise something as todays it should probably be current music and not from 5 to 10 years ago the app uses about 5 times the amount of data as their competitors with comparable music quality all in all there are way better apps and i expect nothing better from apple,1,7/22/2019 18:55,dc4b6a59-151c-4d3b-8b6e-a5dadbd77cd2_1_c4d6c9da,functionality,stops playing music at random times,negative,music playback issues,False,Apple Music,Android
dc4b6a59-151c-4d3b-8b6e-a5dadbd77cd2,this app is garbage it stops playing music at random times and then you have to restart your phone in order to get the music playing again the radio stations are basically play lists with maybe 15 songs on them when you advertise something as todays it should probably be current music and not from 5 to 10 years ago the app uses about 5 times the amount of data as their competitors with comparable music quality all in all there are way better apps and i expect nothing better from apple,1,7/22/2019 18:55,dc4b6a59-151c-4d3b-8b6e-a5dadbd77cd2_2_a558eb1a,other,radio stations have outdated playlists,negative,outdated music selection,False,Apple Music,Android
404a3bed-8729-4bb5-b7af-e718d434ec51,i use this app everyday and it used to be absolutely perfect ive noticed recently that whenever i start a new radio wanting to find new music  i get recommended the same songs over and over again   nearly all the songs im being recommended ive liked in the past and its almost the same playlist every day no matter what new radio station i start it would be nice if there was at least a 7030 ratio of new songs to old ones,3,9/7/2022 20:43,404a3bed-8729-4bb5-b7af-e718d434ec51_1_be8a633c,functionality,repeated song recommendations,neutral,recommendation system,False,YouTube Music,IOS
12d7decb-a1bd-457d-95e2-81b6c08cf586,i like apple music its a good app to listen to music but  the thing is most of the time some songs would change regions and i couldnt listen to it and a lot of songs on other music apps arent on apple music also i noticed that when you go to the listen now tab  if you click on like a playlist of songs that youve listened to it plays the remix or the different version of the song anyways you should download it if you want i dont know,4,7/2/2022 13:54,12d7decb-a1bd-457d-95e2-81b6c08cf586_1_3ade9b8e,functionality,some songs would change regions and I couldn't listen to it,neutral,availability of songs across regions,False,Apple Music,IOS
12d7decb-a1bd-457d-95e2-81b6c08cf586,i like apple music its a good app to listen to music but  the thing is most of the time some songs would change regions and i couldnt listen to it and a lot of songs on other music apps arent on apple music also i noticed that when you go to the listen now tab  if you click on like a playlist of songs that youve listened to it plays the remix or the different version of the song anyways you should download it if you want i dont know,4,7/2/2022 13:54,12d7decb-a1bd-457d-95e2-81b6c08cf586_2_3ffcb8be,other,a lot of songs on other music apps aren't on apple music,neutral,song availability on different platforms,False,Apple Music,IOS
36c01370-1f90-4f59-8a4d-559dd6836a03,i have used apple music for a few years and im generally satisfied however  its frustrating that i cant customize the library page more   i primarily use the library page  and i navigate based on albums i think the app would be better if there were the option to pin things on the library page  so that the exact albumsplaylists i want are at the top  as opposed to just showing my recently added items lately ive been listening a lot to an album i downloaded awhile ago  which means that every time i open the app  i have to navigate to the artists tab  find the artist  then select the album i want if i could just pin the album  it would be so much easier   basically id like it to function the same way as pinning conversations in the messages app   similarly i generally dont make playlists  except for specific uses party  road trip  workout  etc but in my day to day listening  i dont listen to playlists very much i usually listen to albums id rather be able to hide a playlist or somehow remove it from my recenly added   the same way deleting an app from your iphones home screen doesnt remove it from your app library  id like to be able to adjust which items show up when i first open the app,4,11/16/2022 5:38,36c01370-1f90-4f59-8a4d-559dd6836a03_1_2c0ba67c,other,frustrating that i can't customize the library page more,neutral,customization of library page,False,Apple Music,IOS
498aaa4c-9c87-4009-9f64-7a634149174b,the format and usability are great i love the organization for driving and interfacing with my vehicle apps however  multiple times a week i have a podcast episode stop playing if i rewind too far sometimes i will lose my content and have to uninstall and reinstall i almost always lose my play history when that happens,4,12/14/2024 12:12,498aaa4c-9c87-4009-9f64-7a634149174b_1_2bfbd808,functionality,multiple times a week i have a podcast episode stop playing if i rewind too far,neutral,podcast playback issues,False,Amazon Music,Android
5a19b557-4459-4f4f-ae4f-3f7e1736aac7,using it mainly for podcast for the no ads feature but its horrible constantly forgets your spot  randomly starts new episodes and unable to fast forward as will only skip to the next episode honestly not sure if the ad free is enough to justify the pain of using this app,1,2/19/2025 12:05,5a19b557-4459-4f4f-ae4f-3f7e1736aac7_1_652c6fcd,functionality,constantly forgets your spot,negative,podcast functionality issues,False,Amazon Music,Android
fd6ea53c-d620-465d-bf31-951ad794b36d,used to work flawlessly now i can open the app  but i cant search i am able to search occasionally  but it doesnt matter because no music will play it nust spins and spins i uninstalled and reinstalled  but it still doesnt work i thought maybe it was my phone  so i installed it on a samsung galaxy tab a9 asks me if i want to change my country  i state keep it the same  and it goes into a loop whatever they did to the last update makes it unplayable,1,1/22/2025 19:13,fd6ea53c-d620-465d-bf31-951ad794b36d_1_5f07a5de,functionality,app does not play music after searching,negative,search functionality issues,False,Amazon Music,Android
06014d32-22f0-46e9-8703-ce749115f94d,they got a solid app that works excellent and rarely has any issues it is easy to navigate  easy to store music and easy to sort music into playlists i do recommend turning off car mode their discover weeklyrecommendations usually seem based on whoever makes them the most money and seldom feels like it is based on your listening habits the release radar also seems to pepper in artists youd never listen to and again appears based on monetary gain the real issue is that they are constantly pushing political agendas on their home screen i listen to music to escape stress not have it shoved in my face when im trying to destress there is also no way to remove the political garbage from the home screen now the app itself could be a solid 5 stars but as soon as its used to force bad political ideologies without a way to hide it  well then i start to consider using a different platform and can no longer recommend this app please note that i have used this app for years before making this review,3,4/23/2021 14:26,06014d32-22f0-46e9-8703-ce749115f94d_1_dec1fad4,other,constantly pushing political agendas on their home screen,negative,political content on home screen,False,Spotify,IOS
06014d32-22f0-46e9-8703-ce749115f94d,they got a solid app that works excellent and rarely has any issues it is easy to navigate  easy to store music and easy to sort music into playlists i do recommend turning off car mode their discover weeklyrecommendations usually seem based on whoever makes them the most money and seldom feels like it is based on your listening habits the release radar also seems to pepper in artists youd never listen to and again appears based on monetary gain the real issue is that they are constantly pushing political agendas on their home screen i listen to music to escape stress not have it shoved in my face when im trying to destress there is also no way to remove the political garbage from the home screen now the app itself could be a solid 5 stars but as soon as its used to force bad political ideologies without a way to hide it  well then i start to consider using a different platform and can no longer recommend this app please note that i have used this app for years before making this review,3,4/23/2021 14:26,06014d32-22f0-46e9-8703-ce749115f94d_2_1dcc7edf,other,no way to remove the political garbage from the home screen,negative,lack of customization options,False,Spotify,IOS
92604386-6ac5-41b7-8c07-60f9fc5b6d09,amazing music app for to enjoy every music,5,2/26/2025 1:05,92604386-6ac5-41b7-8c07-60f9fc5b6d09_1_25c5908f,other,N/A,Positive,N/A,False,Spotify,Android
960cdabe-3580-45f1-997e-0c3deae0d61b,but then i updated to ios 152 now it has issues playing in my car every time and if i ask siri to skip 3 songs  it wont work unless i actually open my phone and physically hit play on the next song that is bad  considering it happens when im driving  it took a while when i got it for this to really start playing songs i like ive had it a few months now and its getting there just like other music apps  you have to likedislike songs for it to understand what you really want  i do like that it has songs that i couldnt find on other apps,2,1/11/2022 13:12,960cdabe-3580-45f1-997e-0c3deae0d61b_1_377288e0,functionality,issues playing in my car every time,neutral,car compatibility issues,False,Apple Music,IOS
960cdabe-3580-45f1-997e-0c3deae0d61b,but then i updated to ios 152 now it has issues playing in my car every time and if i ask siri to skip 3 songs  it wont work unless i actually open my phone and physically hit play on the next song that is bad  considering it happens when im driving  it took a while when i got it for this to really start playing songs i like ive had it a few months now and its getting there just like other music apps  you have to likedislike songs for it to understand what you really want  i do like that it has songs that i couldnt find on other apps,2,1/11/2022 13:12,960cdabe-3580-45f1-997e-0c3deae0d61b_2_98264826,other,Siri won't skip songs unless I open my phone,neutral,voice command functionality,False,Apple Music,IOS
c8c43912-5922-45c9-8053-a751622b9d7c,its great  everything about it is great  im just confused as to why artists are pulling their songs off the platform pgn music used to have a bunch of medieval style music  like the dancing barmaid and spirits in the wind those songs are no longer available and the song dreams by lost sky not dreams pt 2  the instrumental dreams is also not available  with no explanation given not an apple music issue i dont believe  just disappointed in the fact they pulled their songs,5,2/24/2025 3:14,c8c43912-5922-45c9-8053-a751622b9d7c_1_dcf924a2,other,artists are pulling their songs off the platform,neutral,availability of songs,False,Apple Music,Android
2fdd70e7-00dd-49ae-b886-ee583ec98455,id like to start off with this is amazing  i took a star off for each of my major issues though       at first it was great very very minimal commercials  and i could play anything i wanted this was on a chrome book i do not have premium but i could control where i was in the song and could play any song fully  then i downloaded it on my phone the commercials suddenly tripled  and i couldnt control what song i played nor could i skip parts this was not a huge inconvenience but still irritating         next i have my huge problem i made my playlist and it keeps playing songs i have not added i look through what it has and it has a we added section i do not like a good majority of these songs and there is no way for them not to play or to skip them without running out of skips i want to listen to my music  this is also such a huge problem because i mainly listen when i am relaxing in a bath or showering i try to relax in a bath and it plays a song not on my playlist i dont like i have to sit up  skip it  and try to get back comfortable if i am showering o cant skip it and siri doesnt listen so i have to listen to it this really is the main reason i gave 3 stars  as this pesters me so much i made a playlist to hear songs i want to hear  not songs that are added without consent that i can not get rid of,3,4/29/2022 1:18,2fdd70e7-00dd-49ae-b886-ee583ec98455_1_58246d2f,functionality,I made my playlist and it keeps playing songs I have not added.,neutral,playlist management issues,False,Spotify,IOS
2def7079-5900-4b04-bf1f-895e300fb04b,pathetic i am struggling everyday with one issue or another whether when opening the app or using alexa in my car or connecting to the app in the first place spotify is so seamless in comparison though it has it shortfalls no voice instructions i feel so hapless and cheated especially when i am paying an annual fee for amazon services very disappointing ,1,1/29/2025 5:00,2def7079-5900-4b04-bf1f-895e300fb04b_1_074b42a6,functionality,struggling with issues when opening the app,negative,app functionality issues,False,Amazon Music,Android
7cd4fa5e-2eb2-4749-8679-8c3fb13536c8,premium makes this app good and huge but stills lacking lots of useful features that spotify brings along from the beginning im downgraded it cause high gamma phones to crash when it is switching between wifi and data usage it keeps crashing nonsensical app cant adequate to changing between different types of data traffic,1,1/28/2025 14:29,7cd4fa5e-2eb2-4749-8679-8c3fb13536c8_1_3ce51a01,performance,app crashes when switching between wifi and data,negative,app performance issues due to data switching,False,YouTube Music,Android
78935ec2-1a81-482d-b7e1-41a4d7b527b8,still absolutely no distinction between music and normal videos  playlists edit themselves  songs andor their videos suddenly are not available sometimes the same track from same creator has both statuses simultaneously generated playlists and search results loop almost entirely after 50 tracks cant delete downloaded but unavailable tracks  yes  you cant do that cant listen or delete  genius cant buy and own music google play music was way better than in almost every way possible,1,2/7/2025 7:03,78935ec2-1a81-482d-b7e1-41a4d7b527b8_1_718ac03b,functionality,no distinction between music and normal videos,negative,music categorization issues,False,YouTube Music,Android
78935ec2-1a81-482d-b7e1-41a4d7b527b8,still absolutely no distinction between music and normal videos  playlists edit themselves  songs andor their videos suddenly are not available sometimes the same track from same creator has both statuses simultaneously generated playlists and search results loop almost entirely after 50 tracks cant delete downloaded but unavailable tracks  yes  you cant do that cant listen or delete  genius cant buy and own music google play music was way better than in almost every way possible,1,2/7/2025 7:03,78935ec2-1a81-482d-b7e1-41a4d7b527b8_2_33f05a3f,other,songs and videos suddenly not available,negative,playlist management problems,False,YouTube Music,Android
f8a10c0f-e0e5-4f88-b868-e447943df5aa,the ads are insane i had to watch 3 minutes worth of ads thats insane 3 minutes to listen to justin bieber is js insane also premium i cant buy like no matter what i do ive tried doing it on an older phone which it worked talking about premium  making us pay to look at lyrics is insane this app has changed and its hella annoying also 6 skips an hour is crazy like whag if im listening to a playlist i like and i hear 6 songs ive already listened to today i wanna skip them at least give us like 10 an hour that would be amazing back to the ads i keep getting this dunkin donut add no matter what i do i dont wanna buy a sparkling energy drink i have enough energy to survive the day please change this app back to normal i might get rid of this app the older version was better then whatever this new version is i have 0 idea how some people are putting this at 5 now its more of a 4  im used to this app and really enjoy it but for some odd reason i cant by anything please just change it back to the normal,3,8/31/2024 17:30,f8a10c0f-e0e5-4f88-b868-e447943df5aa_1_94afccc0,ads,ads are excessive,negative,advertisement experience,False,Spotify,IOS
f8a10c0f-e0e5-4f88-b868-e447943df5aa,the ads are insane i had to watch 3 minutes worth of ads thats insane 3 minutes to listen to justin bieber is js insane also premium i cant buy like no matter what i do ive tried doing it on an older phone which it worked talking about premium  making us pay to look at lyrics is insane this app has changed and its hella annoying also 6 skips an hour is crazy like whag if im listening to a playlist i like and i hear 6 songs ive already listened to today i wanna skip them at least give us like 10 an hour that would be amazing back to the ads i keep getting this dunkin donut add no matter what i do i dont wanna buy a sparkling energy drink i have enough energy to survive the day please change this app back to normal i might get rid of this app the older version was better then whatever this new version is i have 0 idea how some people are putting this at 5 now its more of a 4  im used to this app and really enjoy it but for some odd reason i cant by anything please just change it back to the normal,3,8/31/2024 17:30,f8a10c0f-e0e5-4f88-b868-e447943df5aa_2_3e70aede,other,unable to purchase premium,negative,premium purchase issues,False,Spotify,IOS
0e2f66e5-c4a8-43c7-b5de-860dbfe68788,came for lossless music and this my friend is absolute best in love with studio like quality currently playing hi res on ldac,5,1/29/2025 17:01,0e2f66e5-c4a8-43c7-b5de-860dbfe68788_1_38b8d3b7,other,N/A,Positive,N/A,False,Apple Music,Android
67aa5ae4-ea4a-4d31-9692-ae93a22af1e8,the app design is a mess and you can end up unable to get back to the home screen search is absolutely broken and albums are often shown with duplicate and incorrect tracks doing anything often take 30 seconds to respond sucks battery 2x other audio apps its been this way for years so it seems abandoned  except for unwelcome things like adding podcasts and audiobooks the worst of all the music streamers,1,1/28/2025 12:11,67aa5ae4-ea4a-4d31-9692-ae93a22af1e8_1_d14fc1e5,other,app design is a mess,negative,app design issues,False,Amazon Music,Android
